{
  "tenant_id": "11111111-1111-4111-8111-111111111111",
  "provider": "ibkr-engine",
  "source_account": "ibkr-paper",
  "dataset": "us_equities.quotes",
  "entitlement_class": "connected_account",
  "permitted_use": ["display", "non_display", "derived"],
  "freshness_class": "live",
  "retention_days": 7,
  "redistribution_allowed": false,
  "terms_ref": "ibkr-user-account",
  "as_of": "2026-06-24T13:30:00Z"
}
